{
  "spec": "sje/0.1.0",
  "traveler_id": "tvl_conformempt",
  "revision": 1,
  "created_at": "2026-09-16T12:00:00.000Z",
  "buyer": {
    "name": "Northline Equipment",
    "certs": []
  },
  "part": {
    "family": "CNC bracket",
    "part_number": "NL-BRK-4410",
    "material": {
      "spec": "6061-T6"
    },
    "qty": {
      "target": 50,
      "breaks": []
    },
    "processes": []
  },
  "itar": false
}
