{
  "spec": "sje/0.1.0",
  "traveler_id": "tvl_example01",
  "revision": 1,
  "created_at": "2026-09-15T17:00:00.000Z",
  "buyer": {
    "org_id": "org_northline",
    "name": "Northline Equipment",
    "city": "Reno",
    "region": "NV",
    "contact": "buyer@northline.example"
  },
  "part": {
    "family": "CNC bracket",
    "part_number": "NL-BRK-4410",
    "description": "Mounting bracket, brushed, deburred",
    "drawing_rev": "C",
    "material": {
      "spec": "6061-T6",
      "form": "plate",
      "thickness_mm": 6.35
    },
    "qty": {
      "target": 250,
      "breaks": [100, 250, 500]
    },
    "processes": ["laser", "cnc-mill", "deburr"],
    "finish": "brushed",
    "tolerances": "±0.13 mm unless noted",
    "notes": "Break all edges. No tooling marks on show face."
  },
  "need_by": "2026-10-30",
  "incoterms": "FOB",
  "itar": false
}
