{
  "spec": "sje/0.1.0",
  "traveler_id": "tvl_conform0l2",
  "revision": 1,
  "created_at": "2026-09-15T17:00:00.000Z",
  "buyer": {
    "org_id": "org_northline",
    "name": "Northline Equipment",
    "city": "Reno",
    "region": "NV",
    "contact": "buyer@northline.example"
  },
  "part": {
    "family": "CNC bracket",
    "part_number": "NL-BRK-4410",
    "description": "Mounting bracket, brushed, deburred",
    "drawing_rev": "C",
    "material": {
      "spec": "6061-T6",
      "form": "plate",
      "thickness_mm": 6.35
    },
    "qty": {
      "target": 250,
      "breaks": [
        100,
        250,
        500
      ]
    },
    "processes": [
      "laser",
      "cnc-mill",
      "deburr"
    ],
    "finish": "brushed",
    "tolerances": "±0.13 mm unless noted",
    "notes": "Break all edges. No tooling marks on show face."
  },
  "need_by": "2026-10-30",
  "incoterms": "FOB",
  "itar": false,
  "quotes": [
    {
      "quote_id": "qot_conform01",
      "seller": {
        "org_id": "org_summitfab",
        "name": "Summit Fabrication",
        "city": "Sparks",
        "region": "NV",
        "certs": [
          "ISO 9001"
        ]
      },
      "traveler_hash_quoted": "sha384:cf5e363e7740a04383b82d5e5143e6224e3990ac319644d7a4cdd5a2de64fcdab5302530fca5c6b4df91e0312f7f841f",
      "created_at": "2026-09-16T12:00:00.000Z",
      "valid_until": "2039-01-01T00:00:00.000Z",
      "lead_time_days": 21,
      "pricing": {
        "currency": "USD",
        "nre": 35000,
        "lines": [
          {
            "qty": 100,
            "unit": 1850
          },
          {
            "qty": 250,
            "unit": 1420
          },
          {
            "qty": 500,
            "unit": 1175
          }
        ]
      }
    }
  ],
  "award": {
    "quote_id": "qot_conform01",
    "awarded_at": "2026-09-17T09:00:00.000Z",
    "qty": 250
  },
  "ops": [
    {
      "seq": 1,
      "code": "laser"
    },
    {
      "seq": 2,
      "code": "cnc-mill"
    },
    {
      "seq": 3,
      "code": "deburr"
    }
  ],
  "ship_to": {
    "name": "Northline Equipment — Dock 4",
    "line1": "1800 Industrial Way",
    "city": "Reno",
    "region": "NV",
    "postal": "89502",
    "country": "US"
  }
}
